<!DOCTYPE layout SYSTEM "layout.dtd">

<layout width="1024" height="768">
 <rows>
  <widget size="500" name="map2d">
    <papget field="ESTIMATOR:z" x="10" y="150" format="Alt:%.0fm"/>
    <papget field="ESTIMATOR:z_dot" x="10" y="200" format="Climb:%.1fm/s"/>
  </widget>
  <columns>
   <rows size="375">
    <widget size="200" name="strips"/>
   </rows>
   <widget size="400" name="aircraft"/>
   <widget name="alarms"/>
  </columns>
 </rows>
</layout>
